{
  "id": 2,
  "slug": "haresfield-beacon",
  "name": "Haresfield Beacon",
  "status": "published",
  "geometry": {
    "start": {
      "lat": 51.78242,
      "lon": -2.2845,
      "osgb_grid_ref": null,
      "what3words": null
    },
    "route": {
      "type": "LineString",
      "coordinates": [
        [
          -2.2845,
          51.78242
        ],
        [
          -2.28327,
          51.78281
        ],
        [
          -2.28193,
          51.78372
        ],
        [
          -2.27938,
          51.78482
        ],
        [
          -2.27907,
          51.78497
        ],
        [
          -2.27623,
          51.78599
        ],
        [
          -2.27601,
          51.78597
        ],
        [
          -2.27583,
          51.78623
        ],
        [
          -2.27548,
          51.78664
        ],
        [
          -2.27456,
          51.78728
        ],
        [
          -2.27435,
          51.78743
        ],
        [
          -2.27421,
          51.78753
        ],
        [
          -2.27389,
          51.78764
        ],
        [
          -2.27364,
          51.78769
        ],
        [
          -2.2736,
          51.78768
        ],
        [
          -2.27352,
          51.78766
        ],
        [
          -2.27348,
          51.78766
        ],
        [
          -2.27344,
          51.78765
        ],
        [
          -2.27332,
          51.78767
        ],
        [
          -2.27321,
          51.78771
        ],
        [
          -2.27291,
          51.78784
        ],
        [
          -2.27241,
          51.78812
        ],
        [
          -2.27182,
          51.78846
        ],
        [
          -2.27158,
          51.78862
        ],
        [
          -2.27138,
          51.78854
        ],
        [
          -2.27097,
          51.78844
        ],
        [
          -2.27075,
          51.78839
        ],
        [
          -2.27042,
          51.78834
        ],
        [
          -2.27001,
          51.7883
        ],
        [
          -2.26952,
          51.78827
        ],
        [
          -2.26918,
          51.78824
        ],
        [
          -2.26896,
          51.78821
        ],
        [
          -2.2687,
          51.78816
        ],
        [
          -2.26857,
          51.78814
        ],
        [
          -2.26842,
          51.78808
        ],
        [
          -2.2682,
          51.78797
        ],
        [
          -2.26804,
          51.78784
        ],
        [
          -2.26753,
          51.78761
        ],
        [
          -2.26706,
          51.78751
        ],
        [
          -2.26623,
          51.78732
        ],
        [
          -2.26538,
          51.78725
        ],
        [
          -2.26505,
          51.78721
        ],
        [
          -2.2649,
          51.7872
        ],
        [
          -2.26482,
          51.78718
        ],
        [
          -2.26469,
          51.78714
        ],
        [
          -2.26423,
          51.78696
        ],
        [
          -2.26406,
          51.78686
        ],
        [
          -2.26397,
          51.78676
        ],
        [
          -2.26387,
          51.78662
        ],
        [
          -2.26367,
          51.78635
        ],
        [
          -2.26356,
          51.78624
        ],
        [
          -2.26336,
          51.78608
        ],
        [
          -2.26304,
          51.78588
        ],
        [
          -2.26218,
          51.78532
        ],
        [
          -2.26192,
          51.78511
        ],
        [
          -2.2619,
          51.78509
        ],
        [
          -2.26138,
          51.78474
        ],
        [
          -2.26097,
          51.78444
        ],
        [
          -2.26085,
          51.78432
        ],
        [
          -2.26073,
          51.78413
        ],
        [
          -2.2607,
          51.78405
        ],
        [
          -2.2607,
          51.78398
        ],
        [
          -2.26072,
          51.78389
        ],
        [
          -2.26083,
          51.78378
        ],
        [
          -2.26103,
          51.7836
        ],
        [
          -2.26113,
          51.7835
        ],
        [
          -2.26119,
          51.78338
        ],
        [
          -2.26123,
          51.78329
        ],
        [
          -2.26123,
          51.7832
        ],
        [
          -2.26121,
          51.78313
        ],
        [
          -2.26116,
          51.78306
        ],
        [
          -2.26108,
          51.78301
        ],
        [
          -2.26097,
          51.78296
        ],
        [
          -2.26078,
          51.7829
        ],
        [
          -2.2605,
          51.78284
        ],
        [
          -2.26032,
          51.78275
        ],
        [
          -2.26021,
          51.78265
        ],
        [
          -2.26017,
          51.78256
        ],
        [
          -2.26017,
          51.78234
        ],
        [
          -2.26017,
          51.78223
        ],
        [
          -2.26014,
          51.78216
        ],
        [
          -2.26008,
          51.78211
        ],
        [
          -2.26001,
          51.78206
        ],
        [
          -2.25988,
          51.78203
        ],
        [
          -2.25972,
          51.78202
        ],
        [
          -2.25903,
          51.78198
        ],
        [
          -2.25881,
          51.78197
        ],
        [
          -2.25867,
          51.78194
        ],
        [
          -2.25844,
          51.78187
        ],
        [
          -2.25832,
          51.78177
        ],
        [
          -2.2583,
          51.78175
        ],
        [
          -2.25815,
          51.78155
        ],
        [
          -2.25808,
          51.78146
        ],
        [
          -2.25796,
          51.78132
        ],
        [
          -2.25762,
          51.78101
        ],
        [
          -2.2572,
          51.7807
        ],
        [
          -2.2567,
          51.78026
        ],
        [
          -2.25641,
          51.77997
        ],
        [
          -2.25596,
          51.7796
        ],
        [
          -2.25579,
          51.77951
        ],
        [
          -2.25535,
          51.77939
        ],
        [
          -2.25526,
          51.77937
        ],
        [
          -2.25515,
          51.77936
        ],
        [
          -2.25496,
          51.77932
        ],
        [
          -2.25473,
          51.77929
        ],
        [
          -2.25468,
          51.77929
        ],
        [
          -2.25439,
          51.77925
        ],
        [
          -2.25413,
          51.77922
        ],
        [
          -2.254,
          51.77922
        ],
        [
          -2.2538,
          51.77922
        ],
        [
          -2.25341,
          51.77918
        ],
        [
          -2.25302,
          51.77914
        ],
        [
          -2.25246,
          51.77907
        ],
        [
          -2.252,
          51.77896
        ],
        [
          -2.25157,
          51.77883
        ],
        [
          -2.25096,
          51.77859
        ],
        [
          -2.25051,
          51.77831
        ],
        [
          -2.25007,
          51.77782
        ],
        [
          -2.24973,
          51.77757
        ],
        [
          -2.24929,
          51.7774
        ],
        [
          -2.24822,
          51.77696
        ],
        [
          -2.2479,
          51.77685
        ],
        [
          -2.24716,
          51.7766
        ],
        [
          -2.24701,
          51.77654
        ],
        [
          -2.24637,
          51.77632
        ],
        [
          -2.24495,
          51.77584
        ],
        [
          -2.24497,
          51.77582
        ],
        [
          -2.24498,
          51.77581
        ],
        [
          -2.24504,
          51.77576
        ],
        [
          -2.24502,
          51.77574
        ],
        [
          -2.24495,
          51.77572
        ],
        [
          -2.2448,
          51.77564
        ],
        [
          -2.24456,
          51.77553
        ],
        [
          -2.24455,
          51.77552
        ],
        [
          -2.24456,
          51.77547
        ],
        [
          -2.24456,
          51.77539
        ],
        [
          -2.24454,
          51.77531
        ],
        [
          -2.24445,
          51.77505
        ],
        [
          -2.24425,
          51.77477
        ],
        [
          -2.24358,
          51.77445
        ],
        [
          -2.24307,
          51.77421
        ],
        [
          -2.24259,
          51.7739
        ],
        [
          -2.24251,
          51.77363
        ],
        [
          -2.24246,
          51.77317
        ],
        [
          -2.24243,
          51.77292
        ],
        [
          -2.24234,
          51.77274
        ],
        [
          -2.24233,
          51.77256
        ],
        [
          -2.24245,
          51.7724
        ],
        [
          -2.24328,
          51.77183
        ],
        [
          -2.24385,
          51.7714
        ],
        [
          -2.24391,
          51.77132
        ],
        [
          -2.24398,
          51.77115
        ],
        [
          -2.24431,
          51.77062
        ],
        [
          -2.24447,
          51.77048
        ],
        [
          -2.24473,
          51.7703
        ],
        [
          -2.24496,
          51.77017
        ],
        [
          -2.24518,
          51.77007
        ],
        [
          -2.24544,
          51.76992
        ],
        [
          -2.24569,
          51.76976
        ],
        [
          -2.24599,
          51.76963
        ],
        [
          -2.24616,
          51.7695
        ],
        [
          -2.24633,
          51.7693
        ],
        [